{
  "schemaVersion": "openadam.agent-host-preview-distribution.v0.1",
  "status": "unpublished",
  "notarized": false,
  "marketplace": false,
  "publicReleasePublished": false,
  "githubReleasesUrl": "https://github.com/tetracoralla/agent-host-suite/releases",
  "selfHostedIndexUrl": null,
  "gatekeeperNote": "Unsigned macOS builds are not Apple-notarized, and this product does not ship Developer ID signed or App Store builds. After download, try to open Agent Host.app (or the app inside the DMG). If macOS blocks it, open System Settings → Privacy & Security and choose Open Anyway. That warning is expected for this preview. On macOS 14, Control-click → Open may still work; it does not on macOS 15 Sequoia and later. Do not turn off Gatekeeper.",
  "windowsSmartScreenNote": "Unsigned Windows ZIP packages are not Authenticode-signed. Windows SmartScreen may warn on first open; that warning is expected for this preview. Compare the ZIP to SHA256SUMS before extracting.",
  "carriers": [],
  "catalog": null
}
